{
  "schema_version": "specprobe.trace.v1",
  "trace_id": "tr_f8dd65745b90",
  "created_at": "2026-07-23T16:27:13.904661+00:00",
  "engine": {
    "name": "simulator",
    "version": "0.1.0",
    "draft_strategy": "ngram",
    "target_model": "demo-target",
    "draft_model": "demo-ngram",
    "temperature": 0.8,
    "extra": {
      "note": "Synthetic boundary-failure trace for the React lane."
    }
  },
  "request": {
    "prompt": "Here is a minimal example:\n\n```python\n",
    "request_id": null,
    "domain_hint": "mixed"
  },
  "blocks": [
    {
      "block_index": 0,
      "draft_len": 10,
      "rejected_at": 0,
      "bonus_token": null,
      "tokens": [
        {
          "index": 0,
          "token": "The",
          "draft_prob": 0.62,
          "target_prob": 0.04,
          "accept_prob": 0.06451612903225806,
          "outcome": "rejected",
          "token_id": null,
          "display": "The",
          "ratio": 0.06451612903225806,
          "roll": 0.91,
          "tag": "boundary",
          "reason": "Rejected: q/p=0.065 (p=0.6200, q=0.0400, P(accept)=0.0645, roll=0.91)"
        },
        {
          "index": 1,
          "token": " following",
          "draft_prob": 0.48,
          "target_prob": 0.03,
          "accept_prob": 0.0625,
          "outcome": "unverified",
          "token_id": null,
          "display": "\u2420following",
          "ratio": 0.0625,
          "roll": 0.55,
          "tag": null,
          "reason": "Unverified \u2014 block aborted after earlier rejection."
        },
        {
          "index": 2,
          "token": " function",
          "draft_prob": 0.41,
          "target_prob": 0.02,
          "accept_prob": 0.04878048780487805,
          "outcome": "unverified",
          "token_id": null,
          "display": "\u2420function",
          "ratio": 0.04878048780487805,
          "roll": 0.4,
          "tag": null,
          "reason": "Unverified \u2014 block aborted after earlier rejection."
        },
        {
          "index": 3,
          "token": " computes",
          "draft_prob": 0.37,
          "target_prob": 0.02,
          "accept_prob": 0.05405405405405406,
          "outcome": "unverified",
          "token_id": null,
          "display": "\u2420computes",
          "ratio": 0.05405405405405406,
          "roll": 0.22,
          "tag": null,
          "reason": "Unverified \u2014 block aborted after earlier rejection."
        },
        {
          "index": 4,
          "token": "\n",
          "draft_prob": 0.18,
          "target_prob": 0.33,
          "accept_prob": 1.0,
          "outcome": "unverified",
          "token_id": null,
          "display": "\u21b5",
          "ratio": 1.8333333333333335,
          "roll": 0.1,
          "tag": null,
          "reason": "Unverified \u2014 block aborted after earlier rejection."
        },
        {
          "index": 5,
          "token": "def",
          "draft_prob": 0.22,
          "target_prob": 0.71,
          "accept_prob": 1.0,
          "outcome": "unverified",
          "token_id": null,
          "display": "def",
          "ratio": 3.227272727272727,
          "roll": 0.05,
          "tag": null,
          "reason": "Unverified \u2014 block aborted after earlier rejection."
        },
        {
          "index": 6,
          "token": " add",
          "draft_prob": 0.2,
          "target_prob": 0.55,
          "accept_prob": 1.0,
          "outcome": "unverified",
          "token_id": null,
          "display": "\u2420add",
          "ratio": 2.75,
          "roll": 0.05,
          "tag": null,
          "reason": "Unverified \u2014 block aborted after earlier rejection."
        },
        {
          "index": 7,
          "token": "(",
          "draft_prob": 0.19,
          "target_prob": 0.48,
          "accept_prob": 1.0,
          "outcome": "unverified",
          "token_id": null,
          "display": "(",
          "ratio": 2.526315789473684,
          "roll": 0.05,
          "tag": null,
          "reason": "Unverified \u2014 block aborted after earlier rejection."
        },
        {
          "index": 8,
          "token": "a",
          "draft_prob": 0.17,
          "target_prob": 0.44,
          "accept_prob": 1.0,
          "outcome": "unverified",
          "token_id": null,
          "display": "a",
          "ratio": 2.5882352941176467,
          "roll": 0.05,
          "tag": null,
          "reason": "Unverified \u2014 block aborted after earlier rejection."
        },
        {
          "index": 9,
          "token": ",",
          "draft_prob": 0.16,
          "target_prob": 0.4,
          "accept_prob": 1.0,
          "outcome": "unverified",
          "token_id": null,
          "display": ",",
          "ratio": 2.5,
          "roll": 0.05,
          "tag": null,
          "reason": "Unverified \u2014 block aborted after earlier rejection."
        }
      ],
      "structural_failures": [
        {
          "kind": "boundary",
          "label": "Domain boundary failure",
          "detail": "Draft p=0.6200 vs target q=0.0400 on 'The' (q/p=0.065).",
          "token_index": 0
        }
      ]
    }
  ],
  "metrics": {
    "wall_time_ms": 0.619,
    "acceptance_rate": 0.0,
    "tokens_accepted": 0,
    "tokens_drafted": 10
  }
}